incident_date,city,state,description,plan,citation
8/5/2013,blue springs,mo,Employee died after being struck by automotive lift.,unknown,unknown
8/5/2013,amarillo,tx,Forklift operator unloading roofing materials from a tractor trailer died from injuries after a vehicle collision.,unknown,unknown
8/5/2013,columbia city,in,Worker killed after becoming caught and wrapped around driveshaft.,unknown,unknown
8/4/2013,arthur,il,Worker crushed and killed when an overhead door fell on him. ,unknown,unknown
8/4/2013,sobrante,ca,Worker died from injuries after being stabbed.  ,unknown,unknown
8/3/2013,follett,tx,Worker died after being struck in the head by a pipe that fell on him.,unknown,unknown
8/3/2013,burleson,tx,Employee died from head injuries after falling from a ladder while strapping conduit.,unknown,unknown
8/2/2013,gretna,la,Employee died after falling 25 feet through a skylight while replacing the roof on a building.,unknown,unknown
8/2/2013,evansville,in,Roofer electrocuted from overhead power wires.,unknown,unknown
8/2/2013,franklin,nc,Worker killed by carbon monoxide while using a forklift to load pallets. ,unknown,unknown
8/2/2013,aberdeen,sd,Employee died after being thrown from a bucket truck that tipped over while he changed lightbulbs in a parking lot.,unknown,unknown
8/2/2013,alexander,ar,Worker died after falling off a ladder while assessing a building's ventilation.,unknown,unknown
8/1/2013,mt. vernon,ia,Worker died after falling from a water tower while painting.,unknown,unknown
8/1/2013,pasadena,tx,"Employee died after being thrown from, then crushed by the tractor he was using to cut grass.",unknown,unknown
8/1/2013,wilmington,oh,Employee died after falling off a delivery vehicle and onto the road.,unknown,unknown
8/1/2013,sunrise,fl,Employee died after an unsecured steel security gate fell over onto an employee while it was being moved.,unknown,unknown
7/31/2013,kankakee,il,Worker fatally crushed when a vehicle being lifted by a front-end loader fell on him.,unknown,unknown
7/31/2013,new orleans,la,"Worker electrocuted after contacting a 7,200-volt line while connecting an overhead power line to a new electrical pole. ",unknown,unknown
7/31/2013,sarasota,fl,Painter died from injuries after being pinned between aerial lift and eave while positioning the aerial lift. ,unknown,unknown
7/31/2013,scarsdale,ny,Worker repairing telephone lines was killed when his extension ladder was struck by a passing vehicle.,unknown,unknown
7/30/2013,alameda,ca,Employee collapsed and died after performing sandblasting inside a tank on a cargo ship. ,unknown,unknown
7/30/2013,alameda,ca,Worker died while performing sandblasting operations inside a ship tank.,unknown,unknown
7/30/2013,newport beach,ca,Worker drowned while repairing tile in a jacuzzi.,unknown,unknown
7/30/2013,martin,tn,Eight workers hospitalized for carbon monoxide exposure when mulitple propane-powered equipment was used to perform building construction and maintenance.,unknown,unknown
7/30/2013,landsdale,pa,Employee died after being struck and killed by a street sweeper during road repaving work.  ,unknown,unknown
7/30/2013,gold beach,or,Construction worker killed by electric shock.,unknown,unknown
7/29/2013,tavares,fl,Six employees were hospitalized after a fire and explosion occurred in the inventory area of a propane distributor.,unknown,unknown
7/29/2013,fitzgerald,ga,Worker fatally crushed after being caught between stacks of lumber during forklift operations. ,unknown,unknown
7/29/2013,trenton,nd,Employee killed when bulldozer he was operating was struck by an Amtrak train.  ,unknown,unknown
7/29/2013,medford,ok,Employee fatally crushed by bundles of stacked polycoil tubing.,unknown,unknown
7/29/2013,wichita,ks,Worker struck and killed by passing vehicle while operating a weedeater alongside the road.,unknown,unknown
7/29/2013,la cross,wi,Worker died after falling into furnace while performing maintenance on it. ,unknown,unknown
7/28/2013,west allis,wi,Worker died after falling from a rig while removing machinery from a foundry.,unknown,unknown
7/28/2013,live oak,fl,Employee died in a traffic accident.,unknown,unknown
7/28/2013,edmond,ok,Worker electrocuted when energized wires contacted the metal frame of a water pump he was using.,unknown,unknown
7/28/2013,osborn,mo,Farm employee died at the hospital after apparently being stepped on by a bull. ,unknown,unknown
7/27/2013,bethlehem,pa,Worker electrocuted during tree trimming operations when his aerial basket contacted overhead power lines.  ,unknown,unknown
7/27/2013,beachwood,oh,"Four workers hospitalized after exposure to mold, other chemicals during a paint remediation project.",unknown,unknown
7/27/2013,madisonville,tx,Worker died from head injuries after a vehicular accident. ,unknown,unknown
7/26/2013,park,nj,Employee found dead inside a granite stone sauna oven area. ,unknown,unknown
7/26/2013,tollgate,or,Worker killed when a truck rolled over onto him.,unknown,unknown
7/25/2013,rockford,il,Employee crushed when caught between a pipe and the ground while off-loading a trailer.,unknown,unknown
7/25/2013,evanston,il,Employee suffered fatal injuries after being struck in the head by a crowbar. ,unknown,unknown
7/25/2013,sandwich,ma,Worker died after falling nearly 40 feet from a roof. ,unknown,unknown
7/25/2013,vienna,md,Worker died from a 240-foot fall from a cell tower while adjusting an antenna.,unknown,unknown
7/25/2013,houston,tx,Worker died after being pinned between two trucks while preparing to connect a winch line.,unknown,unknown
7/24/2013,bridgeport,tx,Mechanic killed when residual vapors inside a tanker truck ignited while he was replacing the truck's valve.,unknown,unknown
7/24/2013,prineville,or,Worker was crushed while dismantling parts from iron frame for salvage.,unknown,unknown
7/24/2013,wynantskill,ny,Employee killed when a truck rolled over him while he performed road paving operations. ,unknown,unknown
7/24/2013,garland,tx,Employee died after falling 25-feet through a roof opening while installing new air conditioner. ,unknown,unknown
7/23/2013,franklin,oh,Worker killed when a piece of fabricated steel struck him in the chest as he cleaned excess paper pulp from a digester machine.,unknown,unknown
7/23/2013,plymouth,ma,Employee fatally crushed when a piece of formwork he was constructing fell on him.,unknown,unknown
7/23/2013,perry,oh,Worker died after falling backwards from a fork truck while completing tree trimming activities.,unknown,unknown
7/23/2013,aberdeen,sd,Worker struck and killed by a semi-trailer while serving as a spotter at a construction site. ,unknown,unknown
7/23/2013,sparta,tn,Worker died from a 30-foot fall when a suspension scaffolding support cable pulled free.,unknown,unknown
7/23/2013,oklahoma city,ok,Driver died after a PVC pipe rolled off a trailer and struck him.,unknown,unknown
7/22/2013,robersonville,nc,Worker killed after being pulled into the conveyor of a tobacco harvester.   ,unknown,unknown
7/20/2013,aurora,il,Employee killed while cleaning a cement mixer that activated while the employee was inside.,unknown,unknown
7/20/2013,macon,ga,Employee fatally crushed when a portion of a crane fell on him while removing the mast of a latice boom. ,unknown,unknown
7/20/2013,mount carmel,il,Employee struck and killed by tree limb while removing limbs entangled in a telephone line.,unknown,unknown
7/19/2013,south ozone park,ny,Employee died after falling from roof while conducting repairs at private residence.,unknown,unknown
7/19/2013,owensboro,ky,Worker struck and killed by a falling tree while clearing trees.,unknown,unknown
7/19/2013,hemet,ca,Worker struck and killed by falling planting machine located on a flatbed truck. ,unknown,unknown
7/19/2013,brooklyn,ny,Employee died of heat exhaustion while sorting construction debris on a conveyer belt at a concrete recycling plant.,unknown,unknown
7/19/2013,hoboken,nj,Worker electrocuted while replacing wire from a transformer.,unknown,unknown
7/19/2013,virden,il,Worker fatally crushed between sheets of steel and a workbench.,unknown,unknown
7/19/2013,florham park,nj,Employee for a wireless provider found dead on the floor of a bathroom being renovated.,unknown,unknown
7/19/2013,mays landing,nj,Employee died from injuries after work vehicle struck a tree.,unknown,unknown
7/18/2013,kermit,tx,Employee killed after falling off a catwalk while testing a tank filled with hydrogen sulfide.,unknown,unknown
7/18/2013,watford city,nd,Worker died from possible hydrogen sulfide exposure. ,unknown,unknown
7/18/2013,fremont,oh,Worker electrocuted while working at a plastics manufacturing facility. ,unknown,unknown
7/18/2013,belspring,va,Worker died from 60-foot fall while performing tree trimming and removal services for a private resident.,unknown,unknown
7/18/2013,arkansas city,ks,Worker trampled and killed by cattle being unloaded from semi-truck.,unknown,unknown
7/17/2013,springdale,ar,Worker died after a fireball engulfed the room where he was working inside a composite building materials facility.  ,unknown,unknown
7/17/2013,west lafayette,in,Worker killed when run over by a trailer truck within construction zone. ,unknown,unknown
7/17/2013,woodland,wa,Worker killed after being struck by a falling cut cedar tree while performing tree operations.,unknown,unknown
7/17/2013,sidney,il,Employee killed after being engulfed by grain while working inside a grain bin.,unknown,unknown
7/16/2013,allendale,sc,Employee electrocuted after the grinding machine he was operating came into contact with power lines.,unknown,unknown
7/16/2013,winchester,va,Worker found dead underneath a lawnmower.,unknown,unknown
7/16/2013,dayton,oh,Employee died after being pinned between the knuckle of a bachhoe outrigger and the ground. ,unknown,unknown
7/16/2013,omaha,ne,Employee died after falling 30 feet while working on a commercial roofing project.,unknown,unknown
7/16/2013,columbus,oh,Employee killed after being run over by a dump truck.,unknown,unknown
7/15/2013,spring,tx,"Worker riding as a passenger on a forklift was killed when the forklift overturned, crushing him.",unknown,unknown
7/15/2013,quinton,va,Worker died after falling from the second floor stairway of a new home under construction.  ,unknown,unknown
7/15/2013,henderson,tn,Worker killed after being thrown 20 feet from a manbasket after the machine that the basket was attached to rolled down a hill and struck a tree.,unknown,unknown
7/15/2013,north kingstown,ri,Worker died after receiving several electric shocks from a live voltage source inside a panel.,unknown,unknown
7/15/2013,howard lake,mn,Worker fatally crushed by a box of packaged parts while removing banding.,unknown,unknown
7/15/2013,barberton,oh,Worker died after becoming trapped in a winder machine while trying to clear a jam. ,unknown,unknown
7/15/2013,washburn,il,Two workers drowned after going for a swim to cool off.  ,unknown,unknown
7/12/2013,canby,or,Worker crushed when a piece of steel from a press brake fell on him.,unknown,unknown
7/12/2013,la vergne,tn,Worker died after being found pinned under parts from a tire assembly machine.,unknown,unknown
7/12/2013,los angeles,ca,Worker apparently electrocuted while using electric chipping gun to chip concrete inside a 20-foot-deep trench. ,unknown,unknown
7/11/2013,fort wayne,in,Two workers killed when struck by semi-truck while repairing a broken down truck on side of highway.,unknown,unknown
7/11/2013,inc. houston,tx,Employee died from injuries caused by being caught in styrofoam grinder/processor he had been operating.,unknown,unknown
7/11/2013,metaire,la,Employee died from heat-related injuries while replacing a water heater in a residential home attic.,unknown,unknown
7/11/2013,tulare,ca,Worker killed when caught between the carriage and frame of a poly tank carrier.,unknown,unknown
7/11/2013,redwood city,ca,Worker fatally crushed inside a compactor/baler. ,unknown,unknown
7/11/2013,sharpsville,pa,Worker died after being ejected from a bucket truck while trimming and cutting tree limbs.,unknown,unknown
7/10/2013,medina,oh,Employee died from electrical shock while working in an excavation.,unknown,unknown
7/10/2013,pago pago,as,Employee electrocuted when an electrical arc occurred between a power line and crane.,unknown,unknown
7/10/2013,ventura,ca,Volunteer worker died after falling from the fixed steel ladder of a pier onto a park service boat. ,unknown,unknown
7/10/2013,millersburg,oh,Employee died after falling eight feet from a flatbead truck.,unknown,unknown
7/9/2013,lexington,ky,Worker died after falling from ladder while stocking shelves at market.,unknown,unknown
7/9/2013,nowata,ok,Worker died after falling four stories while painting on a hotel roof.,unknown,unknown
7/9/2013,austin,tx,Employee died from apparent electrocution while working on an A/C unit. ,unknown,unknown
7/9/2013,el paso,tx,Worker died after being electrocuted while working on light fixtures.,unknown,unknown
7/8/2013,bittinger,md,Tree service worker electrocuted by high voltage power lines.,unknown,unknown
7/8/2013,claflin,ks,Employee died from exposure to hydrogen sulfide gas while working in an underground saltwater disposal system.,unknown,unknown
7/8/2013,buchanan,tn,Worker electrocuted while removing 277-volt AC wiring.,unknown,unknown
7/8/2013,irving,tx,Employee died from six-foot fall to concrete after contacting an energized junction box.,unknown,unknown
7/8/2013,portland,or,Worker killed after work vehicle's brakes failed causing vehicle to crash through a guardrail and roll down a bank.  ,unknown,unknown
7/8/2013,new town,nd,Two employees died after falling about 225 feet while performing maintenance on a communication tower.  ,unknown,unknown
7/8/2013,claflin,ks,Employee died from exposure to hydrogen sulfide gas while working in an underground saltwater disposal system.,unknown,unknown
7/8/2013,pickstown,sd,Two employees struck and killed by vehicle while they performed field work for fish and wildlife agency.,unknown,unknown
7/8/2013,virginia beach,va, Employee died from ruptured spleen after scraping stomach on bar joists while crawling on walk boards in an attic.,unknown,unknown
7/8/2013,caruthers,ca,Worker died after being runover by a truck.,unknown,unknown
7/7/2013,west union,wv,Worker testing a well hole was killed when a fire erupted at a nearby deisel-powered water pump. ,unknown,unknown
7/7/2013,turlock,ca,"Worker was shot and killed by co-worker's disgruntled spouse, who was attempting to shoot the co-worker. ",unknown,unknown
7/7/2013,west union,wv,Worker testing a well hole was killed when a fire erupted at a nearby deisel-powered water pump. ,unknown,unknown
7/6/2013,okmulgee,ok,Worker died from head injuries on his first day on job after his stand-up forklift hit a shelving unit.,unknown,unknown
7/6/2013,tell city,in,Worker killed after he slipped and fell 50 feet from platform used to perform tank maintenance.,unknown,unknown
7/6/2013,okmulgee,ok,Worker drowned while swimming at Lake Okmulgee.,unknown,unknown
7/5/2013,new york,ny,Employee crushed by pipes that fell from a forklift.,unknown,unknown
7/5/2013,auburn,wa,Worker killed when an alleged drunk driver struck worker's cab. ,unknown,unknown
7/5/2013,richgrove,ca,Worker died from possible heat illness while working at farm.,unknown,unknown
7/5/2013,lakewood,nj,Employee died after falling from a lift in an automotive distribution facility.,unknown,unknown
7/5/2013,chicago,il,Worker struck and killed by train while performing track maintenance.,unknown,unknown
7/5/2013,thousand palms,ca,Emergency rescue worker struck and killed by vehicle while responding to an emergency call on highway ramp.,unknown,unknown
7/5/2013,waterloo,ia,Worker killed after being buried in trench cave-in.  ,unknown,unknown
7/4/2013,chignik,ak,Employee died after entering engine space and falling onto rotating propellar shaft of the vessel.  ,unknown,unknown
7/4/2013,homer,ak,Worker killed when he was pulled into an anchor winch after becoming entangled in an anchor wire rope.,unknown,unknown
7/4/2013,egeik,ak,Employee died after being trapped in a fire on a marine vessel.,unknown,unknown
7/3/2013,watford city,nd,Employee died from possible exposure to chemicals while cleaning the inside of a tank.,unknown,unknown
7/3/2013,la crosse,wi,Worker dies in tugboat that crashed over the roller gates of a river lock.,unknown,unknown
7/3/2013,groveland,ca,"Worker killed when top of oak tree snapped and fell, striking worker's head.",unknown,unknown
7/3/2013,jacksonburg,wv,Truck driver killed after being pinned between a bulldozer and work truck.,unknown,unknown
7/3/2013,ordway,co,Worker struck and killed by a U-shaped metal fastener connected to a pipe line.,unknown,unknown
7/2/2013,auroua,co,Worker electrocuted after making contact with live wire while repairing electrical breaker box.,unknown,unknown
7/2/2013,five points,ca,Worker died from seizure after suffering apparent heat illness while performing farming activities.,unknown,unknown
7/2/2013,stuttgart,ar,Employee died from apparent fall from man lift.,unknown,unknown
7/1/2013,allentown,pa,Employee died from head injuries after falling to the ground from the back of bus/van while loading passenger confined to a wheelchair.,unknown,unknown
7/1/2013,fort smith,ar,Worker died in vehicular accident while moving a cargo truck inside the lot.,unknown,unknown
7/1/2013,oak,ca,Two workers shot and killed at retail store in an apparent robbery.,unknown,unknown
6/29/2013,las vegas,nv,Worker died from 94-foot fall when the wire rope broke during a performance.,unknown,unknown
6/28/2013,yuba city,ca,Worker died from apparent heat stress after suffering a seizure while performing ground preparation.,unknown,unknown
6/28/2013,trabuco canyon,ca,Worker drowned after falling into swimming pool while performing landscaping services.,unknown,unknown
6/27/2013,clayton,nm,Worker killed after being involved in a motor vehicle accident.,unknown,unknown
6/26/2013,san jose,ca,Worker electrocuted when his climbing rope fell onto energized power line.,unknown,unknown
6/25/2013,waterloo,ia,Worker died from head injuries after being struck by powered industrial truck.,unknown,unknown
6/25/2013,monticello,ky,Worker died after falling from bucket truck while cutting tree.,unknown,unknown
6/24/2013,cantril,ia,Worker died after being struck by section of pipe while exiting boom lift that rolled over.,unknown,unknown
6/24/2013,manson,wa,"Worker killed when the orchard tractor fell over six-foot enbankment, rolled down hill and caught fire.",unknown,unknown
6/24/2013,union mills,in,Worker killed when an explosion at grain elevator occurred causing worker to fall 100 feet.,unknown,unknown
6/24/2013,lavergne,tn,"Worker killed when lawnmower overturned, crushing him.",unknown,unknown
6/24/2013,muscatine,ia,Worker died from severe trauma suffered during a tornado.  ,unknown,unknown
6/24/2013,vieques,pr,Worker struck and killed by a concrete beam that fell when a truck crashed into it.,unknown,unknown
6/24/2013,staten island,ny,Worker collapsed and died while pruning hedges. Cause of death under investigation.,unknown,unknown
6/24/2013,upland,ca,Worker drowned after falling into pool while blowing leaves in backyard.,unknown,unknown
6/22/2013,mouthcard,ky,Worker performing landscaping along highway was struck and killed by a motor vehicle.,unknown,unknown
6/22/2013,hughson,ca,Worker fainted and later died after complaining of chest pains while performing outside bench irrigation work.,unknown,unknown
6/20/2013,indianapolis,in,Worker died after falling 15-feet through skylight during roofing repairs.,unknown,unknown
6/19/2013,veedersburg,in,Worker died after being pulled into grain flow while clearing blockage in grain bin. ,unknown,unknown
6/19/2013,des moines,ia,Worker fatally crushed between a garbage truck and parked trailer while directing tow truck.,unknown,unknown
6/18/2013,desert center,ca,Worker died of apparent heat-related illness.,unknown,unknown
6/18/2013,ponce,pr,Worker killed when side walls inside an excavation collapsed.,unknown,unknown
6/18/2013,cambria,ny,Worker killed in a vehicle collision.,unknown,unknown
6/17/2013,lawrenceburg,ky,Worker suffered fatal fall while cutting tree limbs.,unknown,unknown
6/16/2013,smyrna,tn,Worker struck and killed by articulating robot while replacing robot gears.,unknown,unknown
6/15/2013,ontario,ca,Worker crushed and killed by gate while moving cows.,unknown,unknown
6/15/2013,artesia,nm,Worker electrocuted when power line he was repairing contacted another live power line.,unknown,unknown
6/14/2013,rio linda,ca,Worker fatally crushed when delivery truck he was repairing fell on him.,unknown,unknown
6/14/2013,st. carson,ca,Worker died after being caught between a forklift and waste cargo trailer. ,unknown,unknown
6/13/2013,pico rivera,ca,Worker died after falling 17 feet from roof.,unknown,unknown
6/13/2013,sterling,va,Worker killed when caught between the elevator cab and an I-beam while making repairs in elevator shaft.,unknown,unknown
6/13/2013,cupertino,ca,"Worker killed when brakes on tractor failed, causing vehicle to roll hit and hit embankment.",unknown,unknown
6/13/2013,hurley,va,Worker struck and killed by a tree limb.,unknown,unknown
6/12/2013,jackson,mi,Worker died from severe burns after trailer struck a gas line causing an explosion and fire.,unknown,unknown
6/12/2013,bluemont,va,Worker struck in the head and killed when horse he was loading into trailer kicked him.,unknown,unknown
6/11/2013,albuquerque,nm,"Worker crushed and killed when 12,000-pound boom fell on him while changing the boom crane cylinders.",unknown,unknown
6/11/2013,las cruces,nm,Worker killed after being struck in chest by a reciprocating saw.,unknown,unknown
6/11/2013,fulton,md,Worker struck and killed by vehicle while setting cones for road work.,unknown,unknown
6/11/2013,santa clara,ca,Worker killed when struck by elevator counterweight while making repairs.,unknown,unknown
6/9/2013,sunnyvale,ca,Worker shot and killed at worksite parking lot. ,unknown,unknown
6/9/2013,las vegas,nv,Worker on security patrol was shot and killed. ,unknown,unknown
6/8/2013,breaux bridge,la,Employee died from an apparent electrocution while connecting a bin indicator for a chipping unit.,unknown,unknown
6/7/2013,sidney,oh,"A forklift technician died after slipping and falling backwards, striking head on a guardrail.",unknown,unknown
6/7/2013,denmark,wi,Employee working under a sport utility vehicle died from crush injuries when the scissor jack lifting the vehicle failed. ,unknown,unknown
6/6/2013,manchester,ky,Three emergency air evacuation workers killed when helicopter crashed.,unknown,unknown
6/6/2013,miles,tx,Employee drowned after the catloader he was operating fell off of a 30-foot cliff into the river.,unknown,unknown
6/6/2013,manvel,nd,Worker found dead underneath a concrete grinder on a road construction project.,unknown,unknown
6/6/2013,chattanooga,tn,Worker suffered fatal fall while performing mechanical air system service on roof.,unknown,unknown
6/6/2013,fairmont,wv,"Driver killed after trying to stop truck when its brakes released, causing truck to roll backward and strike him.   ",unknown,unknown
6/6/2013,inc. fergus falls,mn,"Worker killed when company van he was repairing rolled off the ramps, crushing him underneath.",unknown,unknown
6/5/2013,summerville,ga,Employee killed after falling 30 feet to lower level during demolition activities.  ,unknown,unknown
6/5/2013,dallas,tx,Two employees were fatally crushed by polyurethane pipes while loading a flatbed trailer. ,unknown,unknown
6/5/2013,big spring,tx,Employee died from apparent heat stress while changing out tong heads during drilling operations. ,unknown,unknown
6/5/2013,west monroe,la,Employee died from fall and crushing injuries after the concrete channels collapsed beneath him while removing roof deck.,unknown,unknown
6/5/2013,portland,or,"Worker killed when the truck he was repairing lurched forward, crushing him under the wheel.",unknown,unknown
6/5/2013,la grande,or,Worker died from 23-foot fall off wooden walkway being built on bridge.,unknown,unknown
6/5/2013,philadelphia,pa,Two employees died when an adjacent 4-story structure under demolition collapsed onto the roof of the store they were working causing it to collapse. ,unknown,unknown
6/4/2013,saginaw,mi,Employee killed after work vehicle was struck by another vehicle.  ,unknown,unknown
6/4/2013,westport,ct,Worker died from head injuries after falling 20 feet from a roof. ,unknown,unknown
6/4/2013,radford,va,Worker killed when tractor-trailer struck him while he removed debris along highway.,unknown,unknown
6/4/2013,dripping springs,tx,"Worker killed when auger he was inside fell to ground, causing machine's side rails to strike worker's neck.",unknown,unknown
6/4/2013,harrisonburg,va,Worker died after falling nearly 10 feet from ladder while painting townhomes.,unknown,unknown
6/4/2013,orlando,fl,Employee died after being pulled against a tree trunk during felling operations.,unknown,unknown
6/4/2013,staten island,ny,Employee found dead under tongue of trailer.,unknown,unknown
6/4/2013,moore,ok,Employee died from head trauma after falling on exterior stairs.,unknown,unknown
6/3/2013,antioch,ca,Worker died from 24-foot fall from roof while making repairs.,unknown,unknown
6/3/2013,spirit lake,ia,Worker struck and killed by a skid loader bucket when the loader tipped forward.,unknown,unknown
6/3/2013,carlsbad,nm,Worker died after falling 25 feet from a rig structure while trying to hook a chain to a ball hook.,unknown,unknown
6/3/2013,milford,nh,Employee died after being crushed by the arms of an unblocked front-end loader.,unknown,unknown
6/2/2013,norfolk,va,Worker killed when crushed between the bottom section of a tractor trailer and the dock. ,unknown,unknown
