incident_date,city,state,description,plan,citation
6/1/2013,south san francisco,ca,Worker killed after falling from a forklift being used to paint a wall. ,unknown,unknown
6/1/2013,cotulla,tx,Employee died from electrical shock while engaged in repairs to electrical system.,unknown,unknown
6/1/2013,chicago,il,Employee died after falling from a ladder while completing a service installation.,unknown,unknown
5/31/2013,blythe,ca,Worker found dead in crop field after checking on irrigation pipes.,unknown,unknown
5/31/2013,st. louis,mo,Worker died after falling from a scaffold while installing tubes for a new HVAC system. ,unknown,unknown
5/31/2013,bronx,ny,"Employee died after the car lift gave way, causing car to fall onto him during repair operations.",unknown,unknown
5/31/2013,conway,wa,Patrol officer struck and killed by truck.,unknown,unknown
5/30/2013,pax,wv,Employee killed after being struck by a clogged and pressurized hose during concrete preparation.,unknown,unknown
5/30/2013,fresno,ca,Worker electrocuted after coming into contact with a live power conductor inside a charging unit.,unknown,unknown
5/30/2013,oakhurst,nj,Worker loading a garbage truck was struck and killed by another vehicle.,unknown,unknown
5/30/2013,rialto,ca,Worker was crushed by forklift.,unknown,unknown
5/29/2013,oakland,ca,Worker died after being caught between two spinners. ,unknown,unknown
5/29/2013,laurel,ms,"Worker killed when a weigh pod from a silo fell on him, knocking him against a steel beam.",unknown,unknown
5/29/2013,college station,tx,"Employee died after being pinned underneath 1,500-pound shoring panels during an excavation.",unknown,unknown
5/29/2013,chino hills,ca,Employee killed when work vehicle's tire blew causing worker to hit guard rail. ,unknown,unknown
5/29/2013,adell,wi,Driver died after being pinned between a conveyor belt and the bottom of a semi-truck. ,unknown,unknown
5/29/2013,columbus,oh,Employee died after being hit by the hospital shuttle bus while walking on hospital's private road.,unknown,unknown
5/29/2013,lafayette,la,Warehouse worker died after falling while operating a forklift picker.,unknown,unknown
5/29/2013,cincinnati,oh,Employee died after being pinned under the front tire of a powered industrial vehicle. ,unknown,unknown
5/29/2013,fort mccoy,wi,"Worker died from head injuries after vehicle he was repairing dropped, pinning him between cab and front bumper.",unknown,unknown
5/28/2013,jackson,tn,Worker killed after being pinned between rear of truck and landing gear of trailer.,unknown,unknown
5/28/2013,georgetown,ms,Two employees died after the gin-pole derrick they were using broke and fell away from a cell phone tower.,unknown,unknown
5/28/2013,providence,ri,Worker killed after being crushed between a truck and loading dock during backing operations.,unknown,unknown
5/28/2013,corpus christi,tx,Worker died after being crushed by a large cylinder during sand blasting operations.,unknown,unknown
5/28/2013,mexico,mo,Warehouse worker died after being crushed by a dockplate during repair and cleaning operations. ,unknown,unknown
5/28/2013,west haven,ct,Worker struck and killed by a train.,unknown,unknown
5/27/2013,wind gap,pa,Worker died after being struck in head by piston that became unhooked from chain.,unknown,unknown
5/27/2013,homeworth,oh,Two workers died after company truck collided with semi-truck during transit.,unknown,unknown
5/27/2013,salado,tx,Worker died after being struck by a rig and elevator after an anchor failed during water well drilling operations.,unknown,unknown
5/27/2013,atu'u,as,Employee died after falling from rafters duing painting operations.,unknown,unknown
5/25/2013,bloomfield,ky,Police officer shot and killed by unknown assailants when he got out of car to remove road debris.,unknown,unknown
5/25/2013,lignite,nd,A temporary employee died after being run over and crushed by a loader. ,unknown,unknown
5/25/2013,san bernadino,ca,Worker crushed by a sliding gate that came off track.  ,unknown,unknown
5/24/2013,chicago,il,Employee died after falling from scaffolding that collapsed while performing tuckpointing at a residential building.,unknown,unknown
5/24/2013,garfield,ar,Employee working on barge died from burns and blunt force trauma after barge exploded during welding operations.  ,unknown,unknown
5/24/2013,new castle,pa,Employee died after being crushed between a box truck and trailer.,unknown,unknown
5/24/2013,elyria,oh,Worker fatally crushed inside a thermo-forming press machine.,unknown,unknown
5/24/2013,san bernadino,ca,Worker struck and killed by train while installing a train derail device.,unknown,unknown
5/23/2013,coatesville,pa,Three employees hospitalized after being burned by hot slag from a furnace. ,unknown,unknown
5/23/2013,maljamar,nm,Worker electrocuted when pole truck hit an overhead power line.,unknown,unknown
5/23/2013,salt lake city,ut,"Worker crushed and killed when 2,000-pound container fell on him.",unknown,unknown
5/23/2013,harrisonville,mo,Worker fatally crushed when two 2x8 vertical beams fell on him.,unknown,unknown
5/23/2013,riviera beach,fl,Worker died from oxygen deficient atmosphere in a confined space. ,unknown,unknown
5/23/2013,lancaster,oh,Employee died after falling through roof while inspecting for wind damage.,unknown,unknown
5/23/2013,bethesda,md,"Worker crushed by scaffolding during relocation of a 44,000-pound section of concrete.",unknown,unknown
5/22/2013,pocatello,id,Worker died from burn injuries after the release of ammonia.,unknown,unknown
5/22/2013,pomona,ca,Worker killed when industrial truck collided with another vehicle. ,unknown,unknown
5/22/2013,livermore,ca,Worker killed when section of pipe flew up from the road striking vehicle windshield.,unknown,unknown
5/22/2013,livermore,ca,Worker fatally crushed by large panel of concrete that fell from forklift.,unknown,unknown
5/22/2013,bear creek,pa,Employee died after being hit by a vehicle while he was setting up a roadway workzone. ,unknown,unknown
5/22/2013,birmingham,al,Employee electrocuted when the pole on digger derrick truck contacted an electrical line.,unknown,unknown
5/22/2013,pomona,ca,"Worker, standing outside of vehicle, was struck and killed when his vehicle was rear-ended causing it to hit him.",unknown,unknown
5/21/2013,brooklyn,ny,Employee died after falling from the third floor level while sheathing exterior of home.,unknown,unknown
5/21/2013,hightown,va,Worker killed after being struck by tree.,unknown,unknown
5/21/2013,bath,pa,Employee died after falling 22 feet from roof while installing timbers for a barn under construction.,unknown,unknown
5/21/2013,dillsburg,pa,Employee died after being run over by a vehicle while delivering home heating oil. ,unknown,unknown
5/21/2013,lakeway,tx,Employee fatally crushed when equipment slid down incline and rolled over him.,unknown,unknown
5/21/2013,superior,wi,Employee fatally injured after being caught between a power roller and conveyor belt.,unknown,unknown
5/20/2013,sequin,wa,Worker died when his vehicle was unable to stop or avoid the vehicle in front that made a sudden turn.,unknown,unknown
5/20/2013,grapevine,tx,Employee died after falling 20 feet while engaged in framing activities at new residential home.  ,unknown,unknown
5/20/2013,cougar,wa,Worker struck and killed by falling tree.,unknown,unknown
5/20/2013,owensboro,ky,Worker electrocuted while painting a bridge.,unknown,unknown
5/17/2013,zionville,nc,Worker in logging crew struck and killed by a falling limb.  ,unknown,unknown
5/17/2013,greenville,ky,Worker struck and killed by lid when a 55-gallon drum exploded.,unknown,unknown
5/17/2013,merrillville,in,Worker electrocuted while installing a new water main.,unknown,unknown
5/17/2013,balltimore,md,Worker crushed and killed by forklift truck and box truck.,unknown,unknown
5/17/2013,camden,nj,Worker crushed and killed when a wall collapsed on him.,unknown,unknown
5/17/2013,las vegas,nv,Worker died when an empty tanker truck he was welding exploded.,unknown,unknown
5/17/2013,oakland,ca,Worker presumed dead after his vehicle was struck by utility tractor and pushed in the bay. Worker's body has not been found.,unknown,unknown
5/17/2013,fort recovery,oh,Employee died from asphyxiation when his apron became entangled in a rotating wire brush while cleaning meat grinding machine.,unknown,unknown
5/17/2013,manalapan,nj,Worker died after tractor rolled over him while trying to pull a tree from the ground.,unknown,unknown
5/16/2013,aurora,il,Worker died after being struck by a 500-pound piece of angle iron.,unknown,unknown
5/16/2013,evanston,il,Employee was struck and killed by construction materials that fell from six stories above.  ,unknown,unknown
5/16/2013,saraland,al,Employee electrocuted while performing repairs on power system equipment.,unknown,unknown
5/16/2013,daphne,al,Employee died from head injuries after falling from a structure while installing trusses.,unknown,unknown
5/16/2013,ely,mn,Worker struck and killed by tree during maintenance services.,unknown,unknown
5/15/2013,hato rey,pr,Worker died from 20-foot fall from roof while performing waterproofing services. ,unknown,unknown
5/15/2013,columbus,ms,Employee died after being crushed between auger and frame of a concrete paver.,unknown,unknown
5/15/2013,st. louis,mo,Machine operator died from electrocution after contacting live electricity in an electrical cabinet. ,unknown,unknown
5/14/2013,hiawatha,ks,Employee died after falling into food processing equipment while attempting to clear a jam.  ,unknown,unknown
5/14/2013,commerce city,co,Construction worker died after falling nearly 30 feet to concrete floor.,unknown,unknown
5/14/2013,dallas,tx,Worker died after being injured while lifting a truck break drum.,unknown,unknown
5/14/2013,vero beach,fl,Worker died after falling from a 10-foot ladder while picking oranges.,unknown,unknown
5/13/2013,miami,fl,Worker died after falling from 7th floor while straightening rebar inside concrete wall opening.,unknown,unknown
5/13/2013,murrieta,ca,"Worker killed when forklift tipped over, crushing him.",unknown,unknown
5/13/2013,winston salem,nc,"Worker killed when bucket lift malfunctioned during tree trimming, causing worker to fall 35 feet.",unknown,unknown
5/12/2013,fort madison,ia,Worker struck and killed by falling tree limb while performing tree trimming operations. ,unknown,unknown
5/12/2013,springs,wv,Employee struck and killed by tree limb during tree cutting operations.,unknown,unknown
5/10/2013,chattanooga,tn,Worker struck and killed when a silo head fell from crane.,unknown,unknown
5/10/2013,romulus,mi,Worker died after a dumpster fell and crushed him.,unknown,unknown
5/9/2013,ferndale,mi,Worker suffered fatal injuries after falling 18 feet from roof.,unknown,unknown
5/9/2013,bloomingdale,il,Worker died after being pinned under a steel coil.,unknown,unknown
5/9/2013,richmond,tx,Employee died after being caught between two tractor graters.  ,unknown,unknown
5/9/2013,austin,tx,Worker died after being crushed under a ditch digger when it rolled down a steep hill.  ,unknown,unknown
5/9/2013,yucca valley,ca,Worker killed after being shot during carjacking.,unknown,unknown
5/9/2013,birmingham,al,"Worker performing warehouse operations died after being pinned between a load and bundles weighing more than 4,000 pounds.",unknown,unknown
5/8/2013,east moline,il,Worker died after semi-trailer collapsed on him during repairs.,unknown,unknown
5/8/2013,elizabeth,nj,Worker killed when vehicle elevated by forklift and chain fell on him while performing repairs.,unknown,unknown
5/8/2013,morrison,ok,Truck driver died after vehicle was struck by train at railroad crossing.  ,unknown,unknown
5/8/2013,rothbury,mi,Worker died after falling 30 feet through skylight during HVAC removal operations.,unknown,unknown
5/8/2013,westland,mi,Worker died when roof collapsed while fighting a fire at a mall.,unknown,unknown
5/7/2013,danville,in,Worker spraying a building with insulation fell approximately 10 feet.,unknown,unknown
5/7/2013,orono,me,Foreman struck and killed by vehicle while constructing a driveway.,unknown,unknown
5/7/2013,union city,ca,Worker died from head injuries when a cart he was pushing was struck by a forklift.,unknown,unknown
5/7/2013,coconut creek,fl,Worker died after falling from ladder while installing air conditioning ducts at construction site.,unknown,unknown
5/7/2013,myton,ut,Worker crushed and killed when a 40-barrel tank exploded at a well site.,unknown,unknown
5/7/2013,chamblee,ga,"Employee died after the scissor lift he was inside malfunctioned, pinning worker between the lift and a pipe. ",unknown,unknown
5/6/2013,runge,tx,Worker died when a flare line pipe struck his head and neck while he attached piping to a well head.,unknown,unknown
5/6/2013,jacksonville,tx,Employee killed when struck by pneumatic gates while unplugging the discharge chute to an asphalt silo.,unknown,unknown
5/6/2013,miami,fl,Employee died after falling from 20-foot ladder while applying caulking inside a warehouse.,unknown,unknown
5/6/2013,kenosha,wi,Driver suffered fatal injuries after truck rolled backward onto him while at a loading dock.,unknown,unknown
5/5/2013,fayetteville,ar,Employee died in a trench collapse. ,unknown,unknown
5/5/2013,janesville,wi,Tractor-trailer driver died after falling from his truck cab at a home improvement store. ,unknown,unknown
5/4/2013,canton,oh,Two carpentry employees died when the crane boom they were using to lift a load fell on them.,unknown,unknown
5/3/2013,denver,co,Worker fatally crushed when the hydraulic compacting mechanism on rear section of trash truck activated.,unknown,unknown
5/3/2013,grnbury,tx,Employee died of head trauma after being caught in machine tool.,unknown,unknown
5/3/2013,panama city beach,fl,Employee died after being caught in and crushed by an automated bowling pin setting machine. ,unknown,unknown
5/3/2013,brooklyn,ny,Employee died after falling four stories to the bottom of an elevator shaft.,unknown,unknown
5/3/2013,caryville,tn,Worker struck and killed by a falling tree.,unknown,unknown
5/3/2013,fremont,oh,Employee killed when oncoming vehicle crashed into work vehicle.,unknown,unknown
5/3/2013,constantia,ny,Employee struck and killed by tree while performing logging operations.,unknown,unknown
5/3/2013,los angeles,ca,Worker found dead during tree trimming operations.,unknown,unknown
5/3/2013,marmarth,nd,Worker died from chest injuries after a belt drive from an oil well pumper unit fell on him.,unknown,unknown
5/2/2013,chama,nm,Worker died when tanker truck rolled over.,unknown,unknown
5/2/2013,mansfield,tx,"Employee killed after 17,000-pound metal coils being moved by a crane fell on him.",unknown,unknown
5/2/2013,point comfort,tx,At least three employees were hospitalized for burns when a flash fire occurred at a plastic resins and petrochemical plant. ,unknown,unknown
5/2/2013,appleton,wi,Farm worker died after being caught in auger.,unknown,unknown
5/2/2013,plainfield,wi,Worker died after being struck and pinned beneath the landing gear of a semi-truck backing up to loading dock.,unknown,unknown
5/2/2013,point comfort,tx,At least three employees were hospitalized for burns when a flash fire occurred at a plastic resins and petrochemical plant. ,unknown,unknown
5/1/2013,coral gables,fl,Employee died after falling nearly 20 feet while installing plants on the inside of a newly constructed nursing facility.,unknown,unknown
5/1/2013,madison,wi,Worker died after falling from a residential roof.,unknown,unknown
4/30/2013,albuquerque,nm,Worker struck and killed by vehicle while securing gate at facility lift station.,unknown,unknown
4/30/2013,greneseo,il,Employee died after falling 25 feet from a beam that broke during roofing operations.   ,unknown,unknown
4/30/2013,west haven,ut,Worker died after falling 30-feet when wind gusts caused roofing material to become airborne and hit worker.,unknown,unknown
4/30/2013,silver lake,or,Worker killed when a tree being cut down fell on him.,unknown,unknown
4/30/2013,mission,tx,"Employee died from head injuries after a set of heavy duty screen doors he was stocking fell on him, knocking him to floor.",unknown,unknown
4/30/2013,finland,mn,Worker killed when excavator slipped on icy road and fell into river.,unknown,unknown
4/29/2013,garden city,ks,"Employee crushed and killed when a metal fence he was cutting fell on him, pinning him underneath. ",unknown,unknown
4/29/2013,madison,va,"Worker died when a hydraulic lift fell, crushing him underneath.",unknown,unknown
4/29/2013,alvin,tx,Employee died after being struck by a tree during tree cutting operations.,unknown,unknown
4/29/2013,west crossett,ar,Employee found dead at bottom of crude oil tank from apparent over-exposure while performing cleaning operations.,unknown,unknown
4/29/2013,yakima,wa,Worker died from injuries after falling off and being run over by a tractor.,unknown,unknown
4/27/2013,philadelphia,pa,Employee electrocuted after contacting energized electrical lines and adjacent copper piping.,unknown,unknown
4/27/2013,cooksville,md,Worker died from a 17-foot fall from a roof.,unknown,unknown
4/27/2013,shamrock,tx,Employee died after being pulled into conveyor while removing a rock that was stuck in machine.,unknown,unknown
4/27/2013,kendalll,fl,Worker died after falling off tractor and striking head on rake of the tractor.,unknown,unknown
4/27/2013,bemidji,mn,"Employee died when hand railing on catwalk gave way, causing worker to fall 40 feet. ",unknown,unknown
4/26/2013,kansas city,mo,Employee killed when debris from a wall being demolished struck his head.,unknown,unknown
4/26/2013,clackamas,or,Worker died after spray hose he used to clean meat blender got caught on rotating blade and pulled him into machine.,unknown,unknown
4/26/2013,alpharetta,ga,Employee died after being struck by tree during tree removal operations. ,unknown,unknown
4/25/2013,smyrna,tn,Worker died when large control panel he was moving tipped over on him.,unknown,unknown
4/25/2013,wilmington,de,Worker died after being struck by cable used to pull tree limbs into shredder.,unknown,unknown
4/25/2013,mountain view,hi,Worker electrocuted after contacting live parts inside cabinet of well pump motor.,unknown,unknown
4/25/2013,menifree,ca,Worker electrocuted while working in underground vault.,unknown,unknown
4/25/2013,big bear city,ca,"Worker killed when ladder used during painting operations fell, landing on worker. ",unknown,unknown
4/24/2013,oakton,va,Worker died from head injuries after being struck by tree he was cutting down.,unknown,unknown
4/24/2013,grosse tete,la,Employee died from injuries after a traffic accident with a 18-wheel truck.,unknown,unknown
4/24/2013,astoria,ny,Worker killed after falling from ladder at end of train platform and tumbling in front of a train.  ,unknown,unknown
4/24/2013,mobile,al,Three employees burned while cleaning a fuel barge that exploded.,unknown,unknown
4/24/2013,st. petersburg beach,fl,Employee crushed and killed by elevator car while cleaning water out of an elevator shaft. ,unknown,unknown
4/23/2013,altus,ok,Employee in a bucket lift died after being pinned between bucket and I-beam.  ,unknown,unknown
4/23/2013,las vegas,nv,Worker killed when concrete pipe rolled off truck bed and crushed him.,unknown,unknown
4/23/2013,seatac,wa,Worker died when an airline baggage cart with tug struck him as cart was being pulled to exit gate.,unknown,unknown
4/23/2013,ramsey,in,Worker killed after vehicle was hit by oncoming train. ,unknown,unknown
4/23/2013,perryton,tx,Employee was found dead from suspected carbon monoxide poisoning while steam cleaning carpet with a gas-powered steamer. ,unknown,unknown
4/22/2013,louisiana,mo,Employee died after lawnmower he was repairing fell on him.,unknown,unknown
4/22/2013,kettle falls,wa,Worker killed after being run over by another vehicle while disconnecting a semi from a trailer.,unknown,unknown
4/22/2013,alexandria city,al,Employee died after being caught between boom lift and iron used during welding operations.,unknown,unknown
4/22/2013,beatty,or,Worker died after ATV flipped over embankment and landed on top of him.,unknown,unknown
4/22/2013,dexter,mi,Worker killed in explosion while welding tank in waste water treatment plant.,unknown,unknown
4/22/2013,beaumont,tx,Employee died after being caught between a rotating excavator and piping while engaging in trench/piping operations.,unknown,unknown
4/21/2013,far rockaway,ny,Employee died after falling from a scaffold.,unknown,unknown
4/21/2013,columbia,tn,Worker killed after being pinned under mower that rolled down steep embankment.,unknown,unknown
4/21/2013,st. augustine,fl,Employee died after being struck by a forklift.,unknown,unknown
4/21/2013,tyler,tx,Employee died after being overcome by fumes while spray painting.,unknown,unknown
4/20/2013,tampa,fl,Employee died after falling 15 feet from ladder while pressure washing a house. ,unknown,unknown
4/20/2013,abilene,tx,Employee struck and killed by vehicle while surveying roadway activity.,unknown,unknown
4/20/2013,beloit,wi,Worker died from head injuries after falling 9 feet from ladder at food market warehouse. ,unknown,unknown
4/19/2013,inverness,fl,Employee struck and killed by tree limb.,unknown,unknown
4/19/2013,las piedras,pr,Worker struck in head and killed by corrugated carton sheets. ,unknown,unknown
4/19/2013,sioux falls,sd,Employee for indoor/outdoor recreation distributor died after his work vehicle was struck by a semi-truck.  ,unknown,unknown
4/19/2013,lakewood,co,Employee died after tripping over book bin.,unknown,unknown
4/19/2013,santa rosa,ca,Worker died when sheets of glass fell on him.,unknown,unknown
4/19/2013,milton,wi,Employee died after being engulfed in grain bin.,unknown,unknown
4/18/2013,manchester,ok,Employee died after being struck by side boom track equipment during construction of natural gas pipeline.,unknown,unknown
4/18/2013,lynn,ma,Worker died from possible drowning after falling in water while working on pier.,unknown,unknown
4/18/2013,carson,ca,Worker struck and killed by fallen bale of shredded paper in warehouse. ,unknown,unknown
4/18/2013,jackson,nj,"Worker died from head injuries when landscaping equipment struck him, causing him to fall.",unknown,unknown
4/18/2013,jeffersonville,in,"Worker killed when a fiber glass cover, lifted off the ground by wind gusts, struck him.",unknown,unknown
4/18/2013,jeffersonville,in,"Employee struck and killed by a 2,200-pound barge lid that became airborne.",unknown,unknown
4/18/2013,charlotte,nc,Landscape worker killed after being hit in head by piece of metal anchor.,unknown,unknown
4/18/2013,hendersonville,tn,"Two workers killed, a third hospitalized after being struck by a 24-foot tall masonry wall that collapsed during 40 mph wind gusts.",unknown,unknown
4/17/2013,rockwall,tx,Worker killed after being struck by vehicle while flagging traffic during roadside construction.,unknown,unknown
4/17/2013,goodlettsville,tn,"Worker died after lawn tractor tipped over, pinning worker between ground and equipment. ",unknown,unknown
4/17/2013,beaumont,tx,At least three employees were hospitalized for burns after flash fire occurred while they worked on a heat exchanger.,unknown,unknown
4/17/2013,beaumont,tx,Worker died from injuries after a refinery fire.,unknown,unknown
4/16/2013,towson,md,Worker struck and killed by motor vehicle while performing landscaping activities.,unknown,unknown
4/16/2013,pendelton,sc,Worker died from 70-foot fall when falling tree hit crane bucket.,unknown,unknown
4/16/2013,west memphis,ar,Two employees died after being struck by a vehicle that entered a construction work zone.,unknown,unknown
4/16/2013,santa fe springs,ca,Worker died after falling from trailer being loaded with lumber. ,unknown,unknown
4/16/2013,holiday,fl,Employee died from heat stroke while installing an electrical box in attic.,unknown,unknown
4/16/2013,oxford,pa,Employee killed after a wall-mounted kitchen grill fell on her head. ,unknown,unknown
4/16/2013,moody,al,"Worker died from injuries after vehicle hit work truck, causing a fiber optic line to strike and sever worker's arm.",unknown,unknown
4/16/2013,brownsville,ky,Worker crushed and killed when a roll-back wrecker he was repairing rolled off blocks.,unknown,unknown
4/15/2013,richmond,ky,Worker struck and killed by falling tree.,unknown,unknown
4/15/2013,brunswick,ga,Employee died after falling through a metal roof opening.,unknown,unknown
4/15/2013,coquille,or,Worker drowned after being trapped under pontoon raft that struck tree and flipped over. ,unknown,unknown
4/15/2013,denver,co,Worker died after another vehicle struck his taxicab.,unknown,unknown
4/14/2013,sheppard afb,tx,Employee died after falling 25 feet off roof while installing insulation.,unknown,unknown
4/13/2013,sunny isles beach,fl,Employee died after falling approximately 36 ft from a sheer wall.,unknown,unknown
4/13/2013,dorchester,ma,Employee died after being struck by a falling load while unloading 40' lengths of pipe from a flatbed trailer.,unknown,unknown
4/12/2013,houston,tx,Employee died after being struck and pinned in between a container and skid steer. ,unknown,unknown
4/12/2013,anaheim,ca,Worker died after being crushed between palletizer and another object. ,unknown,unknown
4/12/2013,hebron,oh,Worker making bridge repairs was killed after being struck by a falling beam.,unknown,unknown
4/11/2013,wick,wv,"Employee died from burn injuries after a flash fire occurred while working at a pipeline cleanout ""pigging"" operation.",unknown,unknown
4/11/2013,tampa,fl,Employee died from possible hydrogen sulfide exposure while cleaning sewage from pipe.,unknown,unknown
4/11/2013,friona,tx,Temporary worker died after falling 45 feet from platform while performing maintenance on grain conveyor.  ,unknown,unknown
